{
    "id":  "012",
    "tier":  2,
    "description":  "Merge sorted lists.",
    "problem":  "Merge two sorted integer lists into a single sorted list.",
    "function_signature":  "def merge_sorted(a, b):",
    "instruction":  "Implement merge_sorted(a, b).",
    "constraints":  [
                        "Input lists already sorted ascending"
                    ],
    "io_examples":  [
                        {
                            "input":  [
                                          [
                                              1,
                                              3,
                                              5
                                          ],
                                          [
                                              2,
                                              4
                                          ]
                                      ],
                            "output":  [
                                           1,
                                           2,
                                           3,
                                           4,
                                           5
                                       ]
                        }
                    ],
    "acceptance_contract":  {
                                "mode":  "function",
                                "required_artifacts":  [
                                                           "run.log",
                                                           "report.json"
                                                       ],
                                "pass_conditions":  [
                                                        "Function returns expected values for examples",
                                                        "Required artifacts are produced",
                                                        "Task-level checks pass"
                                                    ],
                                "determinism_profile":  "strict",
                                "quality_required_keywords":  [
                                                                  "def merge_sorted(",
                                                                  "return"
                                                              ],
                                "quality_forbidden_keywords":  [
                                                                   "__main__",
                                                                   "print(",
                                                                   "run_cli",
                                                                   "log_crash"
                                                               ]
                            },
    "evaluation":  {
                       "type":  "function_examples",
                       "function_name":  "merge_sorted",
                       "examples":  [
                                        {
                                            "args":  [
                                                         [
                                                             1,
                                                             3,
                                                             5
                                                         ],
                                                         [
                                                             2,
                                                             4
                                                         ]
                                                     ],
                                            "expected":  [
                                                             1,
                                                             2,
                                                             3,
                                                             4,
                                                             5
                                                         ]
                                        },
                                        {
                                            "args":  [
                                                         [

                                                         ],
                                                         [
                                                             1,
                                                             2
                                                         ]
                                                     ],
                                            "expected":  [
                                                             1,
                                                             2
                                                         ]
                                        }
                                    ]
                   }
}
