{
  "id": "007",
  "tier": 1,
  "description": "Check palindrome.",
  "problem": "Return True if the string is a palindrome, else False.",
  "function_signature": "def is_palindrome(s):",
  "instruction": "Implement is_palindrome(s).",
  "constraints": [
    "Case-sensitive exact match"
  ],
  "io_examples": [
    {
      "input": [
        "racecar"
      ],
      "output": true
    },
    {
      "input": [
        "hello"
      ],
      "output": false
    }
  ],
  "acceptance_contract": {
    "mode": "function",
    "required_artifacts": [
      "run.log",
      "report.json"
    ],
    "pass_conditions": [
      "Function returns expected values for examples",
      "Required artifacts are produced",
      "Task-level checks pass"
    ],
    "determinism_profile": "strict",
    "quality_required_keywords": [
      "def is_palindrome(",
      "return"
    ],
    "quality_forbidden_keywords": [
      "__main__",
      "print(",
      "run_cli",
      "log_crash"
    ]
  },
  "evaluation": {
    "type": "function_examples",
    "function_name": "is_palindrome",
    "examples": [
      {
        "args": [
          "racecar"
        ],
        "expected": true
      },
      {
        "args": [
          "hello"
        ],
        "expected": false
      },
      {
        "args": [
          ""
        ],
        "expected": true
      }
    ]
  }
}
